{
  "schema": 1,
  "id": "unread-msg-example-1",
  "connection": "gmail",
  "collector": "unread",
  "key": "msg-example-1",
  "ts": "2026-01-01T09:14:00Z",
  "kind": "gmail.unread",
  "title": "Welcome to sample-project",
  "body": "someone@example.com",
  "url": "https://mail.google.com/mail/u/0/#inbox/msg-example-1",
  "status": "done",
  "created_at": "2026-01-01T09:15:00Z",
  "updated_at": "2026-01-01T09:20:00Z",
  "decided": {"action": "accepted", "at": "2026-01-01T09:20:00Z"},
  "session_id": "5c1e4d2a-0000-4000-8000-000000000001",
  "outcome": "reply_drafted"
}
